Q,A,label,,,,
"월요일 2,3 교양 뭐 있어?",조용준 교수님의 포스트모던아트읽기 수업 / 김종국 교수님의 영상예술의 이해 수업 / 배라영 교수님의 청년발달과 자기이해 수업이있어,221,,,,
"월요일 2,3 교양 알려줘",조용준 교수님의 포스트모던아트읽기 수업 / 김종국 교수님의 영상예술의 이해 수업 / 배라영 교수님의 청년발달과 자기이해 수업이있어,221,,,,
영상예술의 이해 수업 온라인 수업이야?,"어떤 학기에는 대면 수업:

1교시: 단편영화 감상 + 단톡/채팅에 한줄평 쓰기

2교시: 이론 설명 후 40분쯤에 마치는 패턴

또 어떤 학기에는 사이버/비대면으로 진행:

중간·기말 시험 없이 온라인 과제 5~6개로 대체

그래서 학기마다 형식이 달라졌던 과목이야.
현재 수강하려면 시간표/공지에서 “사이버인지, 대면인지”를 확인해야 해.",52,,,,
영상예술의 이해 수업 프로젝트 있어?,"팀별 영상 제작 / 영상 만들기 프로젝트

조별로 모여서 촬영하고 편집해서 제출하는 형태 (2번 정도 했다는 후기도 있음)

비대면 학기 후기들은 개인 레포트 과제 중심이고, 팀 프로젝트 언급은 거의 없음.",52,,,,
영상예술의 이해 수업 중간고사 있어?,"대면일 때:

중간고사 있음.

형식: 논술/서술형 위주(3문제 정도)

오픈북 아니고, 앞뒤 꽉 채워 쓰는 스타일을 요구.

비대면 학기:

“사이버라서 시험은 없었고, 중간·기말 대체 과제로 레포트 제출”이라는 후기 있음.",52,,,,
영상예술의 이해 수업 기말고사 있어?,"구조는 중간과 동일:

기말고사도 논술형·서술형 3문제 정도, 오픈북X

수업 PPT 내용 + 수업에서 본 영화들 중심으로 출제.

비대면 학기에는:

기말도 레포트 과제(2페이지 내외)로 대체.",52,,,,
영상예술의 이해 수업 과제 있어?,"대면/시험 있는 버전

“과제 없음”이라는 후기도 있지만,

공통적으로 매주 단편영화 보고 한 줄 감상문을 단톡·게시판에 올리는 건 있음.

사이버/비대면 버전

과제 5~6개

중간·기말 시험도 2페이지 내외 레포트 과제로 대체

주제: 수업 내용/영상 이론을 실제 영화나 영상에 적용해서 분석하는 식.",52,,,,
영상예술의 이해 수업 과제 어려워?,"레포트/대체 과제:

분량은 보통 2페이지 내외지만

“주제가 쉬운 편은 아니고, 생각을 꽤 많이 해야 한다”

영화를 자주 보는 사람은 괜찮은데, 영화 안 보는 사람에겐 조금 빡셌다는 후기 있음.

그래도 다들

시간은 일주일 이상 넉넉히 준다

“열심히 쓰면 A+ 받았다”고 해서 시간만 들이면 충분히 할 수 있는 수준.",52,,,,
영상예술의 이해 수업 교수님 어때?,"긍정:

“수업에 열정이 있고, 영상 이론·실습 모두 잘 설명해준다”

“배워가는 게 많고, 영화·영상 보는 눈이 넓어지는 수업”

“출결 챙기고 열심히 하면 누구나 A+ 가능”

부정:

강의와 상관없는 잡담·잡설이 많다

특히 정치 이야기, 성별 관련 발언 등 불편했다는 의견도 여러 개

수업이 중구난방 같고, 잡담 때문에 집중이 안 된다는 리뷰도 있음.",52,,,,
영상예술의 이해 수업 퀴즈 있어?,"매주 단편영화 한줄평이 출석·참여 체크 겸 가벼운 평가 역할.

비대면 버전에선 과제 5~6개가 퀴즈 대신 평가 역할을 하고 있음.",52,,,,
영상예술의 이해 수업 난이도는?,"“가볍게 듣는 교양으로는 비추”, “내용도 깊이가 있어서 시험까지 생각하면 힘들다”

영상 이론, 영화 분석 등을 다루기 때문에 생각보다 학술적인 부분이 있음.",52,,,,
영상예술의 이해 수업 팀플 있어?,"영상 만들기 팀플 언급 (조별 영상 제작 / 두 번 모여서 찍었다 등)

카메라 실습 + 팀 프로젝트 기반 수업인 경우도 있음.

싸강/과제 위주 학기 후기에서는 팀플 언급이 없고, 완전 개인 과제만 했다는 사람도 있음.",52,,,,
영상예술의 이해 수업 시험 어떻게 나와?,"형식:

중간·기말 둘 다 논술/서술형 위주(3문제 정도)

오픈북 아님. 시험 시간은 50분인데, 실제론 체감상 조금 빡빡했다는 후기도 있음.

출제 범위:

PPT 위주 + 수업에서 강조한 포인트

수업 중 본 단편영화·사례들 정리해두고, 그 의미·기법 등을 쓰는 문제

채점 분위기:

“앞뒤만 꽉 채워 쓰면 점수 잘 나온다”

“시험 문제 다 짚어준다”는 말도 있어서,
수업+PPT만 충실히 보면 큰 악랄함은 없는 시험.",52,,,,
"화요일 6,7 교양 뭐 있어?",김종국 교수님의 영상예술의 이해 수업이 있어,52,,,,
"화요일 6,7 교양 알려줘",김종국 교수님의 영상예술의 이해 수업이 있어,52,,,,
현대생활과 체육 수업 온라인 수업이야?,"학기마다 다름.

대면일 경우: 조모임 활동+게임 실습 중심이라 매우 즐거웠다는 후기가 많음.

비대면일 경우: 영상 보고 게임 설명 레포트 제출 등 과제가 많아 비추라는 의견 다수.",53,,,,
현대생활과 체육 수업 프로젝트 있어?,"대면: 여러 활동형 조모임·레크리에이션 실습(게임 설명하기 등).

비대면: 조별 영상 제작 후 편집해서 제출하는 과제 존재.",53,,,,
현대생활과 체육 수업 중간고사 있어?,"있음.

하지만 필기시험이 아니라 실기시험 형태.

당일에 게임 설명·활동 수행하는 정도라 아주 부담이 적음.",53,,,,
현대생활과 체육 수업 기말고사 있어?,"있음.

역시 실기시험이며, 2주 전에 어떤 게임을 할지 알려주는 편.

게임 설명하거나 활동 시연하는 방식.",53,,,,
현대생활과 체육 수업 과제 있어?,"대면: 매주 일지 작성(일기·체험 기록) 정도.

비대면:

게임 이름·방법 정리 보고서

조별 영상 촬영·편집

중간·기말 대체 과제 등
→ 총 4~6개 정도로 더 많음.",53,,,,
현대생활과 체육 수업 과제 어려워?,"대면 기준: 어렵지 않음. 일지 정도라 부담 적음.

비대면 기준: 영상 편집·보고서 등 꽤 귀찮고 번거롭다는 후기 많음.",53,,,,
현대생활과 체육 수업 교수님 어때?,"공통적으로 매우 좋다는 평가가 압도적.

열정적이고, 학생들 잘 챙기고, 활발하게 참여하면 점수 매우 잘 줌.

""인생에 썰 많이 생기는 수업"", ""또 듣고 싶다""는 후기 다수.",53,,,,
현대생활과 체육 수업 퀴즈 있어?,"퀴즈는 없음.

대신 참여·출석·조모임 점수가 매우 큼.",53,,,,
현대생활과 체육 수업 난이도는?,"대면: 난이도 매우 낮음 = 최강 꿀교

참여만 하면 A 가능

사람 만나는 걸 좋아하면 최적

비대면: 난이도 중간~높음

영상 과제+보고서가 귀찮아 힘들다는 후기 다수",53,,,,
현대생활과 체육 수업 팀플 있어?,"대면: 거의 매주 조모임 + 팀활동 + 게임 실습

비대면: 조별 영상 촬영 팀플 존재",53,,,,
현대생활과 체육 수업 시험 어떻게 나와?,"필기시험 없음 → 100% 실기시험

게임을 앞에서 설명하거나

시범 보이면 끝

점수도 참여·성실도가 가장 중요.

팀 활동 점수 잘 쌓아두면 시험 때 거의 프리패스라는 후기도 있음.",53,,,,
색채디자인의 이해 수업 온라인 수업이야?,"대면·비대면 둘 다 있는 편.

대면이 훨씬 재미있다는 후기가 많음(수업 분위기·색칠 활동·교수님 소통 때문).

비대면은 과제·공지 느림 때문에 아쉽다는 평가 존재.",54,,,,
색채디자인의 이해 수업 프로젝트 있어?,"팀플 없음.

중간·기말 모두 대체과제(PPT / 레포트) 방식인 경우가 많음.

수업 중 색칠·컬러링·필기 같은 소규모 실습 과제가 있음.",54,,,,
색채디자인의 이해 수업 중간고사 있어?,"험 없는 경우가 많음 → 대체과제(PPT)

또는 “나를 색으로 표현하기” 발표로 대체되기도 함.

필기시험 형태는 거의 없음.",54,,,,
색채디자인의 이해 수업 기말고사 있어?,"기말도 시험 대신 레포트·색칠 과제 제출로 대체되는 경우 다수.

대면일 땐 가끔 빈칸 채우기 필기시험을 본다는 후기도 있음.",54,,,,
색채디자인의 이해 수업 과제 있어?,"있어. 컬러링(색칠) 과제

수업 필기

영상 감상문

중간 PPT

기말 레포트

대체로 많지는 않지만, 몰아서 하면 매우 힘들다는 후기 다수.",54,,,,
색채디자인의 이해 수업 과제 어려워?,"난이도 자체는 어렵지 않음.

하지만 양이 많아질 수 있음, 특히 색칠·필기 몰아서 하면 손목 나간다는 후기 있음.

공지가 느려서 일정 관리가 어렵다고 느끼는 사람들도 있음.",54,,,,
색채디자인의 이해 수업 교수님 어때?,"유쾌하고, 영하고, 오픈 마인드라는 평가가 압도적으로 많음.

수업 재밌게 하려고 노력함, 선물 주거나 분위기 좋음(대면 기준).

다만 공지 느림, 백석톡 답장 늦음, 강의 재탕이 아쉽다는 의견도 일부 있음.",54,,,,
색채디자인의 이해 수업 퀴즈 있어?,"퀴즈는 거의 없음.

가끔 수업 시간에 간단한 퀴즈가 있을 수 있으나 부담 無.",54,,,,
색채디자인의 이해 수업 난이도는?,"전체적으로 쉬운 편, 꿀교양이라는 후기 다수.

하지만 과제가 누적되면 빡셀 수 있음

색채·디자인에 관심 있으면 훨씬 쉬움.

디영 학생은 특히 더 쉽게 느꼈다는 의견 있음.",54,,,,
색채디자인의 이해 수업 팀플 있어?,"팀플 없음.

100% 개인 과제 + 개인 발표.",54,,,,
색채디자인의 이해 수업 시험 어떻게 나와?,"대부분 중간·기말 대체과제(PPT + 레포트)

대면 기준: 기말 빈칸 시험 보기 가능 (필기한 내용 전부에서 출제).

시험 자체는 어렵지 않지만 암기량은 많을 수 있음.

성적은 대체로 잘 나오는 편(조금만 맞아도 A+ 준다는 후기도 있음).",54,,,,
클래식음악 산책 수업 온라인 수업이야?,"아니야, 대면 수업이야.

대면 기준으로 클래식 음악을 직접 들으며 진행하는 형태",55,,,,
클래식음악 산책 수업 프로젝트 있어?,"프로젝트 없음.

팀플도 없음.

가끔 연주회 감상문(기말 대체과제) 1개가 나오는 정도",55,,,,
클래식음악 산책 수업 중간고사 있어?,"있음.

중간 필기시험(암기 위주)

중요한 부분을 수업 중에 교수님이 직접 힌트로 알려주심.",55,,,,
클래식음악 산책 수업 기말고사 있어?,"있음.

중간과 동일하게 필기시험.

교수님이 시험 힌트 많이 줘서 난이도는 쉬운 편.

추가로 기말 연주회 감상문 과제가 나오는 학기 있음.",55,,,,
클래식음악 산책 수업 과제 있어?,"과제 거의 없음.

있는 경우: 오케스트라/연주회 감상문 1개

나머지는 시험 2번이 전부.",55,,,,
클래식음악 산책 수업 과제 어려워?,"감상문 자체는 어렵지 않음.

다만 연주회 감상문은 직접 공연을 들어야 해서 조금 번거롭다는 후기도 있음.",55,,,,
클래식음악 산책 수업 교수님 어때?,"후기 대부분이 “진짜 너무 친절함”, “학생 편의 잘 챙겨줌”, “배려심 많음”

출석도 아주 유연함 (1교시 못 찍어도 2교시 찍으면 인정해주는 등).

시험 때 힌트 제공, 간식 제공 같은 배려 많음.

학생 잘 챙기고 말투·태도 모두 좋다는 평가가 압도적.",55,,,,
클래식음악 산책 수업 퀴즈 있어?,"퀴즈는 거의 없음.

메인 평가 방식은 중간·기말 시험.",55,,,,
클래식음악 산책 수업 난이도는?,"전체적으로는 꿀교양에 가까움.

단, PPT 분량이 매우 많고 암기양이 많다는 후기도 존재.

클래식 음악 자체가 졸릴 수 있음(실제로 잔다는 후기 많음).

클래식 관심 있으면 매우 쉬움 / 암기 싫어하면 조금 부담될 수 있음.",55,,,,
클래식음악 산책 수업 팀플 있어?,팀플 없음,55,,,,
클래식음악 산책 수업 시험 어떻게 나와?,"시험은 중간 + 기말 필기시험 2번

유형:

작곡가 이름

시대 구분

곡 제목

중요한 이론 내용

힌트를 거의 다 알려줘서 진입장벽 낮음.

PPT 분량은 많지만, 힌트 중심으로 공부하면 성적 잘 나옴.",55,,,,
현대사회와 디자인 수업 온라인 수업이야?,"대면 수업이야.

단, 대면 중간에 갑자기 오전 9시 실시간 줌수업을 하기도 함(이것 때문에 상당히 헷갈렸다는 후기 있음).

영상 강의는 대부분 재탕 영상(이전 연도 것)이 올라옴.",55,,,,
현대사회와 디자인 수업 프로젝트 있어?,"프로젝트라고 할 만한 건 없음.

수업의 ‘전부’가 PPT 만들기 + 발표 2회임.

실질적 팀플 없음. 개인 발표 중심.",56,,,,
현대사회와 디자인 수업 중간고사 있어?,"없음.

대신 중간에 PPT 제작 + 발표로 대체.",56,,,,
현대사회와 디자인 수업 기말고사 있어?,"없음.

기말도 PPT 제작 + 발표로 진행.

오프라인 발표가 아니라 줌 발표 형태.",56,,,,
현대사회와 디자인 수업 과제 있어?,"거의 모든 수업이 과제임.

중간 PPT, 기말 PPT 외에도 간간히 추가 과제 나옴.

“수업은 거의 안 하는데 과제는 계속 있다”는 리뷰가 매우 많음.",56,,,,
현대사회와 디자인 수업 과제 어려워?,"난이도 자체는 높지 않음.

하지만 교수님이 원하는 스타일이 명확해서,
→ 안 맞으면 열심히 해도 점수 낮게 주는 경우 존재.

평가 기준이 명확하지 않다는 불만이 압도적으로 많음.",56,,,,
현대사회와 디자인 수업 교수님 어때?,"설명을 잘 못함

수업의 질이 낮음 (화이트보드 쬐깐한 칠판에 이상하게 그림 그림)

학생 발표 중에 전화받음 (여러 후기에서 반복 언급됨)

성적 기준 모호함

발표 순서(조별) 불공평하다는 후기

공지 헷갈리게 함 / 오전 줌 갑자기 잡힘",56,,,,
현대사회와 디자인 수업 퀴즈 있어?,"퀴즈 없음.

평가: 발표 2회 + 과제",56,,,,
현대사회와 디자인 수업 난이도는?,"난이도 자체는 낮음.

하지만 학점 받기 어려움.

평가기준 불명확 + 교수님 스타일에 종속적.

배우는 것도 거의 없음 → 실제로 “뭘 배운 건지 모르겠다” 후기가 다수.",56,,,,
현대사회와 디자인 수업 팀플 있어?,"팀플 없음.

개인 PPT 발표 2회가 전부.",56,,,,
현대사회와 디자인 수업 시험 어떻게 나와?,"시험 없음.

중간, 기말 모두 PPT 제작 + 줌 발표

발표 때 교수님이 원하는 흐름/스타일에 맞추는 것이 중요.

평가 기준이 공개되지 않아 학점 예측이 어려운 편.",56,,,,
"화요일 8,9 교양 뭐 있어?",조은환 교수님의 현대사회와 디자인 수업이 있어,56,,,,
"화요일 8,9 교양 알려줘",조은환 교수님의 현대사회와 디자인 수업이 있어,56,,,,
유광현 교수님의 태권도의이론과실제 수업 온라인 수업이야?,"대면 수업이야.

직접 동작을 배우는 실기 중심이라 대면으로 진행됨",57,,,,
유광현 교수님의 태권도의이론과실제 수업 수업 프로젝트 있어?,"프로젝트 없음.

실기 배우고 동작 테스트 보는 정도.",57,,,,
유광현 교수님의 태권도의이론과실제 수업 수업 중간고사 있어?,"리뷰에 따르면 중간고사 있음.

하지만 난이도가 어렵지 않다는 평가.",57,,,,
유광현 교수님의 태권도의이론과실제 수업 기말고사 있어?,"기말고사 있음.

실기 중심으로 진행되며 교수님이 차근차근 알려주셔서 무리 없이 준비 가능.",57,,,,
유광현 교수님의 태권도의이론과실제 수업 과제 있어?,"리뷰 기준으로 보면 별도의 과제는 거의 없음.

수업 자체가 실기라 과제 부담은 거의 없는 편.",57,,,,
유광현 교수님의 태권도의이론과실제 수업 과제 어려워?,과제 자체가 거의 없으므로 어려움도 없음.,57,,,,
유광현 교수님의 태권도의이론과실제 수업 교수님 어때?,"학생들이 공통적으로 말하는 특징 요약:

정말 친절하고 열정적임

“모르겠다고 하면 직접 잡아서 알려준다”는 후기 있음

분위기 편안하고 학생들과 소통 잘함

귀엽고 친근한 스타일이라는 평도 있음

전체적으로 학생 만족도가 매우 높음.",57,,,,
유광현 교수님의 태권도의이론과실제 수업 퀴즈 있어?,퀴즈 없음,57,,,,
유광현 교수님의 태권도의이론과실제 수업 난이도는?,"낮은 편.

교수님이 하나하나 자세히 알려줘서 “좋은 성적 받기 쉬웠다”는 평가 존재.",57,,,,
유광현 교수님의 태권도의이론과실제 수업 팀플 있어?,팀플 없음,57,,,,
유광현 교수님의 태권도의이론과실제 수업 시험 어떻게 나와?,"실기 위주

실기 동작 + 기본 이론 정도

난이도는 어렵지 않으며, 교수님이 시험을 위해 필요한 부분을 잘 알려주시는 스타일

실기 중심이라 “따라만 하면 점수 잘 나온다”는 분위기",57,,,,
"목요일 1,2 교양 뭐 있어?",유광현 교수님의 태권도의이론과실제 수업이 있어,57,,,,
"목요일 1,2 교양 알려줘",유광현 교수님의 태권도의이론과실제 수업이 있어,57,,,,
웨이트트레이닝이론과실제 수업 온라인 수업이야?,"대면 수업이야.

실기 중심이라 직접 운동 동작을 배우는 방식",58,,,,
웨이트트레이닝이론과실제 수업 프로젝트 있어?,"프로젝트 없음.

대신 중간 레포트 1개가 프로젝트처럼 평가됨.",58,,,,
웨이트트레이닝이론과실제 수업 중간고사 있어?,"중간은 필기시험 대신 레포트 제출(대체 과제).

분량과 자세함에 따라 점수 갈린다는 평가.",58,,,,
웨이트트레이닝이론과실제 수업 기말고사 있어?,"기말 필기시험 있음(대면) 미리 문제를 알려주긴 하지만, 시험 공지가 불명확함 시간제한 갑자기 말함
문제 해석이 이상하거나 모순된 지시
등이 리뷰에서 매우 많이 언급됨.",58,,,,
웨이트트레이닝이론과실제 수업 과제 있어?,중간 대체 레포트 1개.,58,,,,
웨이트트레이닝이론과실제 수업 과제 어려워?,"어렵다는 평가 많음.

분량·디테일에 따라 점수 차이 큼.

성적 기준이 명확하지 않아 불만이 많음.",58,,,,
웨이트트레이닝이론과실제 수업 교수님 어때?,"운동 자세를 정확하게 가르쳐주지 못한다는 의견 다수 존재
소통이 잘 안 되고 공지가 불친절하다는 평가
수업 퀄리티가 낮고 내용이 거의 남지 않는다는 반응 많음
시험 설명이 바뀌거나 모순된 지시를 한다는 평가
일부 학생은 ""그럭저럭 괜찮았다"" 정도의 반응을 남김",58,,,,
웨이트트레이닝이론과실제 수업 퀴즈 있어?,퀴즈 없음,58,,,,
웨이트트레이닝이론과실제 수업 난이도는?,"난이도 자체는 실기라 어려운 편은 아니지만,
시험 문제·지침·평가 기준 때문에 난이도가 오히려 올라가는 느낌

실기 자체는 “그냥 운동 수준”이라 쉬운 편.",58,,,,
웨이트트레이닝이론과실제 수업 팀플 있어?,팀플 없음,58,,,,
웨이트트레이닝이론과실제 수업 시험 어떻게 나와?,"중간 → 레포트

기말 → 대면 필기시험

교수님이 시험 문제 일부를 미리 알려주지만

문제 지시가 중간/후반에 서로 다르게 바뀌고

여러 의미로 해석되는 문제가 있음

시간 제한을 뒤늦게 말함
등으로 학생들이 가장 많이 불만을 표함.",58,,,,
유튜버와영상제작 수업 온라인 수업이야?,"대면 수업이야.

컴퓨터실에서 프로그램 사용하며 직접 영상 제작함",59,,,,
유튜버와영상제작 수업 프로젝트 있어?,"중간·기말 영상 제작 과제가 프로젝트 역할을 함.

영상(쇼츠/릴스 형태)을 직접 만들어 제출해야 함.",59,,,,
유튜버와영상제작 수업 중간고사 있어?,중간시험 없음.대신 직접 영상 제작(쇼츠 1개)이 중간 평가.,59,,,,
유튜버와영상제작 수업 기말고사 있어?,"기말시험 없음.

기말도 영상 제작(쇼츠 영상 + 유튜브 업로드)으로 대체.",59,,,,
유튜버와영상제작 수업 과제 있어?,"중간 영상 1개 + 기말 영상 1개

수업시간에 편집 실습 진행하며 별도의 과제는 거의 없음.

기말 영상은 자신의 유튜브 채널에 공개 업로드해야 함.",59,,,,
유튜버와영상제작 수업 과제 어려워?,"편집/영상 제작 경험 있으면 매우 쉬움

초보자도 교수님이 계속 돌아다니며 알려주기 때문에 무난

하지만 창의력이 부족하면

영상 주제 잡기

차별화 만들기가
꽤 어렵다는 리뷰 존재

학생들이 서로 직접 평가(동료평가) 하는 게 부담스럽다는 의견도 있음.",59,,,,
유튜버와영상제작 수업 교수님 어때?,"엄청 친절함 / 천사같음 / 나긋나긋하고 편안함 . 모르면 자리로 와서 1:1로 피드백
이름 외우고 개별적으로 도와주려는 스타일
진도 못 따라오면 다음 주에 다시 챙겨주시는 분 학생들 배려를 많이 함",59,,,,
유튜버와영상제작 수업 퀴즈 있어?,퀴즈없음,59,,,,
유튜버와영상제작 수업 난이도는?,"전체적으로 매우 쉬운 교양

따라가기 쉽고 프로그램 난이도 낮음

영상 제작 경험 있으면 난이도 1~2 수준

완전 초보라도 교수님이 계속 알려줘서 무난

단, 창의력·영상 주제 선정은 사람에 따라 난이도가 느껴질 수 있음",59,,,,
유튜버와영상제작 수업 팀플 있어?,팀플 없음,59,,,,
유튜버와영상제작 수업 시험 어떻게 나와?,"중간 → 쇼츠 영상 제작 제출

기말 → 쇼츠 영상 + 유튜브 채널 공개 업로드

시험 대신 영상 결과물을 전원과 함께 시청 + 동료평가

음향, 편집, 연출 등 항목으로 학생들이 서로 평가함

교수님도 개인별로 피드백 제공

가끔 “내 영상이 모두 앞에서 재생되는 것만 부끄럽다”는 리뷰 존재",59,,,,
창작곡과유튜브 수업 온라인 수업이야?,"대면 수업이지만, 분위기는 매우 편안하고 이론 + 실습으로 진행돼. 온라인 강의 느낌처럼 친절하게 하나하나 알려주셔서 부담이 적어.",60,,,,
창작곡과유튜브 수업 프로젝트 있어?,"중간 과제: Musescore로 직접 작곡하기

기말 과제: 본인이 만든 곡에 맞춰 영상 제작 후 유튜브 업로드
프로그램 사용법도 교수님이 직접 기초부터 알려주셔서 비전공자도 가능해.",60,,,,
창작곡과유튜브 수업 중간고사 있어?,중간고사는 작곡 과제로 대체돼.,60,,,,
창작곡과유튜브 수업 기말고사 있어?,기말은 영상 제작 프로젝트 제출이야.,60,,,,
창작곡과유튜브 수업 과제 있어?,"중간: 곡 만들기

기말: 영상 만들기
하지만 학생들 대부분이 ""할 만하다"", ""부담 적다"", ""교수님이 다 도와주신다""고 평가해.",60,,,,
창작곡과유튜브 수업 과제 어려워?,"비전공자라면 처음엔 낯설 수 있지만,
교수님이 차근차근 알려주시고 피드백도 바로바로 해주셔서 전혀 어렵지 않다는 평이 압도적으로 많아.
실용음악과 학생들은 물론이고, 컴공/스과/타전공도 A~A+ 많이 받았다는 리뷰가 많아.",60,,,,
창작곡과유튜브 수업 교수님 어때?,"목소리 나긋나긋

너무 친절함

피드백 바로바로

질문하면 다 알려줌

수업 빨리 끝내주심

학생들 챙겨줌
대부분 “교수님이 진짜 엔젤”, “한 번 더 듣고 싶다” 라는 평가가 많아.",60,,,,
창작곡과유튜브 수업 퀴즈 있어?,퀴즈 없음,60,,,,
창작곡과유튜브 수업 난이도는?,"낮은 편 – 하지만 배우는 건 유익함.
이론은 조금 졸릴 수 있지만, 몰라도 작곡·영상 제작은 할 수 있어.
전공자들이 조금 유리할 뿐이고 비전공자도 충분히 잘함.",60,,,,
창작곡과유튜브 수업 팀플 있어?,전부 개인 작업.,60,,,,
창작곡과유튜브 수업 시험 어떻게 나와?,"시험 자체가 아예 없어.

중간: 직접 만든 음악 제출

기말: 음악 + 영상 제작
작품 퀄리티보다 ‘성실히 만들었는지, 표현하려는 분위기가 있는지’가 더 중요하다고 함.",60,,,,
"화요일 5,6 교양 뭐 있어?",이은화 교수님의 창작곡과유튜브 수업 / 최완욱 교수님의 골프의이론과실제 수업 / 이상연 교수님의 음악을 통한 심리학의 이해 수업 / 이승원 교수님의 천안의 이해 수업 / 박영진 교수님의 성공취업실전 수업이 있어,222,,,,
